11:01:48.526753 ARP, Request who-has 192.168.10.200 tell 192.168.10.201, length 28
11:01:48.527016 ARP, Reply 192.168.10.200 is-at 02:01:02:03:04:05, length 46
11:01:48.527031 IP 192.168.10.201.39480 > 192.168.10.200.1234: Flags [S], seq 3230712780, win 29200, options [mss 1460,sackOK,TS val 1648571567 ecr 0,nop,wscale 7], length 0
11:01:48.527263 IP 192.168.10.200.1234 > 192.168.10.201.39480: Flags [R.], seq 0, ack 3230712781, win 0, length 0
11:01:53.729575 ARP, Request who-has 192.168.10.201 tell 192.168.10.200, length 46
11:01:53.729598 ARP, Reply 192.168.10.201 is-at 02:09:08:07:06:05, length 28
